{
  "format": "datapass.links",
  "version": 1,
  "title": "Energy ETL demo — useful pages (fictional)",
  "description": "Every address is a fictional example.com page: the demo client does not exist.",
  "groups": [
    {
      "id": "workspaces",
      "title": "Workspaces",
      "links": [
        { "label": "Databricks workspace (dev)", "url": "https://databricks.example.com/hl-energy-dev", "kind": "workspace", "environment": "dev", "description": "Job meter-energy and the analytics SQL warehouse." },
        { "label": "Data Factory Studio (dev)", "url": "https://adf.example.com/factories/adf-hlenergydev", "kind": "workspace", "environment": "dev" },
        { "label": "Airflow (dev)", "url": "https://airflow.example.com/dags/meter_readings_daily/grid", "kind": "workspace", "environment": "dev" }
      ]
    },
    {
      "id": "dashboards",
      "title": "Dashboards",
      "links": [
        { "label": "Energy report (placeholder)", "url": "https://powerbi.example.com/reports/site-energy", "kind": "dashboard", "environment": "prod" },
        { "label": "Energy API (local)", "url": "http://localhost:8080/docs", "kind": "dashboard", "description": "When the container runs on this computer." }
      ]
    },
    {
      "id": "project",
      "title": "Project",
      "links": [
        { "label": "Resource group (dev)", "url": "https://portal.example.com/resource-groups/rg-hlenergy-dev", "kind": "portal", "environment": "dev" },
        { "label": "Spark jobs repository", "url": "https://git.example.com/harbourlight/spark-jobs", "kind": "repository" },
        { "label": "Data platform runbook", "url": "https://docs.example.com/harbourlight/runbook", "kind": "docs" }
      ]
    }
  ]
}
